{
  "rubric_version": "v1.1",
  "audited_at": "2026-09-08",
  "target": "https://nextjs.org",
  "audience_language": "zh",
  "sampled_urls": [
    "https://nextjs.org/",
    "https://nextjs.org/learn",
    "https://nextjs.org/showcase",
    "https://nextjs.org/docs/app/getting-started/installation",
    "https://nextjs.org/docs/app/api-reference/directives/use-cache",
    "https://nextjs.org/blog/how-we-closed-1500-github-issues",
    "https://nextjs.org/blog/turbopack-chunking",
    "https://nextjs.org/blog/august-2026-security-release"
  ],
  "checks": [
    {
      "id": "g.robots",
      "state": "scored",
      "points": 3,
      "max": 5,
      "tier_reason": "只有「未显式禁止也未显式放行」这一档：robots.txt 全文 40 字节，通篇没有任何 User-agent 组，因此既拿不到第 5 档要求的「对主流检索 UA 明确放行」，也不落入第 0 档的 Disallow。第 5 档要的是显式 Allow，缺省允许不等于显式放行。",
      "evidence": "GET https://nextjs.org/robots.txt → HTTP 200，size_download=40 字节。hexdump 全文逐字节为 `Sitemap: https://nextjs.org/sitemap.xml\\n`（0x53 69 74 65 6d 61 70 ... 0x0a），无 User-agent、无 Allow、无 Disallow。换 GPTBot UA 与 bingbot UA 重取，同为 HTTP 200 / 40 字节 / 同一行内容，排除按 UA 分发不同 robots 的可能。"
    },
    {
      "id": "g.reachable",
      "state": "scored",
      "points": 5,
      "max": 5,
      "tier_reason": "落第 5 档而非第 3 档，是按量表规则 6「判定看实质不看格式」判的：8×10=80 个检索 UA 单元全部 200，无一被拦；正文与浏览器视图一致，字节差异来自站点主动对 AI 代理做 text/markdown 内容协商（是升级不是降级），不是第 3 档所指的拦截或劣化。逐字节比对已排除「同尺寸不同 MD5」是内容差异。",
      "evidence": "8 个 URL × 10 个检索 UA（GPTBot / OAI-SearchBot / ChatGPT-User / ClaudeBot / Claude-SearchBot / PerplexityBot / Perplexity-User / Google-Extended / Applebot / Bingbot）= 80 个请求，全部 HTTP 200（首轮 showcase|Perplexity-User 一次 curl(35) SSL_ERROR_SYSCALL，重取即 200 / 200404 字节 / MD5 9c658cbc2cac9925119e387bdc696aa5，判为传输层偶发）。分发模式：首页对 8 个 UA 返回 text/markdown 3939 字节 MD5 d78fc2ce20be349709252ad2ba50077d，浏览器 Chrome UA 返回 text/html 345712 字节 MD5 05e7417b894cc604bc36ff7ed2af5a63，Applebot/Bingbot 返回 text/html 446849 字节；docs-usecache 对 8 个 UA 返回 markdown 31968 字节 MD5 8b14025fccf9ce437277bc5fc48c88e8，Applebot/Bingbot 返回 html 1433287 字节。markdown 版含同一正文原句（首页：\"The React framework for the web. Next.js is used to build full-stack web applications...\"）。/learn 无 markdown 变体，browser 与 GPTBot 同为 411339 字节但 MD5 不同（a6f09776… vs f949ed08…），逐字符 diff 定位到第 294558 字节的 React 随机 key（\"bXG2ljt8iONffroXdJGBsv\" vs \"BDMbW-EB8YkUUtHXt0R2zv\"），非内容差异。"
    },
    {
      "id": "g.ssr",
      "state": "scored",
      "points": 5,
      "max": 5,
      "tier_reason": "第 5 档「抽样页正文均在 HTML 响应中」——8/8 通过，无一页需要执行 JS 才出正文，因此不落第 3 档「部分页可见」。",
      "evidence": "对 8 个页面的浏览器 UA HTML 响应剥离 <script>/<style>/<svg> 后抽正文（未执行任何 JS）：home 7682 字符/1133 词、learn 4636/707、showcase 3731/539、docs-install 16757/2373、docs-usecache 29807/4558、blog-issues 10212/1669、blog-turbo 13248/2284、blog-sec 3318/470。命中原句可复核：blog-issues 的 \"Friday, September 4th 2026 How we closed 1,500 GitHub issues in one month Posted by M…\"、docs-usecache 的 \"The use cache directive allows you to mark a route, React component, or a function as cacheable.\"。反向佐证：拿 HTML 的爬虫收到的比浏览器更多——docs-usecache 给 Bingbot 1433287 字节 vs 给 Chrome 974728 字节。"
    },
    {
      "id": "p1.sitemap",
      "state": "scored",
      "points": 4,
      "max": 4,
      "tier_reason": "第 4 档「且多数 URL 带 lastmod」——lastmod 覆盖率 100%，不是「多数」而是全部，无更高档可取。",
      "evidence": "robots.txt 声明 Sitemap: https://nextjs.org/sitemap.xml；GET 该 URL → HTTP 200，size_download=103007 字节，Content-Type application/xml。<loc> 计数 734，<lastmod> 计数 734（734/734 = 100%）。非 sitemapindex（grep sitemapindex = 0）。最新 lastmod 为 2026-09-04T18:13:26.655Z（/blog/how-we-closed-1500-github-issues），与今日 2026-09-08 相差 4 天。"
    },
    {
      "id": "p1.llms-txt",
      "state": "scored",
      "points": 5,
      "max": 5,
      "tier_reason": "第 5 档需要「含站点定义段」+「2 个以上含链接的主题分节」，两条都远超线：定义段是标准 llms.txt 的 H1+blockquote 形态，含链接主题分节有 5 个（要求 ≥2）。",
      "evidence": "GET https://nextjs.org/llms.txt → HTTP 200，12724 字节。第 1 行 `# Next.js`，第 3 行 `> The React Framework for the Web` 构成站点定义段；正文第 5 段进一步定义 \"Next.js is a React framework for building full-stack web applications.\"。标题结构（grep '^#'）：## When to use nextjs.org / ### How to read it efficiently / ## Documentation / ### Versioned Documentation / ## Support Policy / ### Version Support / ### Currently Supported Versions / ## Learn Next.js / ## Blog (Showing Last 2 Years)。全文含链接 52 处（grep -c ']\\(http'）。"
    },
    {
      "id": "p1.organization",
      "state": "scored",
      "points": 3,
      "max": 6,
      "tier_reason": "只能落第 3 档「有其一」，虽然两者其实都有：第 5 档要求「两者齐全，含 name／url／logo」，而全站抽样 JSON-LD 里 logo 属性出现 0 次，logo 缺失就上不去第 5 档；第 6 档要的 sameAs 反而已具备但被第 5 档卡住。这是阶梯把 logo 设成 sameAs 的前置条件造成的结果，不是站点两个实体真的只有一个。",
      "evidence": "首页单个 application/ld+json 块内 @graph 三节点：SoftwareApplication(@id .../#software)、WebSite(@id .../#website, url/name/description/inLanguage/about/publisher 齐全)、Organization(@id .../#publisher, name \"Vercel\", url https://vercel.com, sameAs 4 条)。SoftwareApplication 另带 sameAs 6 条。对 8 个抽样页的 browser+Bingbot HTML 共 16 份响应 grep '\"logo\"' → 命中 0 次（唯二命中在 YouTube 页面，非本站）。首页 <head> 亦无 rel=\"logo\" 或 ImageObject。"
    },
    {
      "id": "p1.breadcrumb",
      "state": "scored",
      "points": 0,
      "max": 3,
      "tier_reason": "第 2 档「部分层级页有」都不成立：抽样含两个五级深度的文档页，BreadcrumbList 命中数为 0。站点有明确层级（/docs/app/api-reference/directives/use-cache），因此不适用「全站无层级则退出分母」的豁免，留在分母记 0。",
      "evidence": "对 8 个抽样页的 browser UA HTML + Bingbot UA HTML（共 16 份）grep 'BreadcrumbList' → 全部 0 次；另查 /learn/dashboard-app/getting-started 与 /conf/session/the-open-web 亦为 0。站内层级客观存在：docs-install 页面可见面包屑文案 \"Using App Router / Getting Started / Installation\"，URL 深度 /docs/app/api-reference/directives/use-cache 为 5 级；sitemap 734 条 URL 中 508 条在 /docs 下。"
    },
    {
      "id": "p1.page-type",
      "state": "scored",
      "points": 4,
      "max": 4,
      "tier_reason": "第 4 档「适用页型普遍有，且字段真实」：按 sitemap 体量，/docs 508 + /learn 113 + /blog 79 = 700/734（95.4%）的 URL 所属页型都带页型专用 schema 且字段是真值，不是占位。未取更低档是因为覆盖不是「部分页型」而是主体页型全覆盖；扣分理由不存在于本项阶梯（缺口在 /conf 的 25 条，占 3.4%）。",
      "evidence": "docs-install → TechArticle{headline \"Getting Started: Installation\", dateModified \"2026-07-21\", url, image, author Organization Vercel}；docs-usecache → TechArticle{dateModified \"2026-08-25\"}；blog-issues/blog-turbo/blog-sec → TechArticle{author 为 Person 数组, dateCreated 2026-09-04T04:00Z / 2026-09-03T16:00Z / 2026-08-25T18:00Z}；/learn/dashboard-app/getting-started → LearningResource{headline \"App Router: Getting Started\", url, image}；首页 → SoftwareApplication{softwareVersion \"16.3.4\", license, codeRepository}。sitemap 页型分布：/docs 508、/learn 113、/blog 79、/conf 25、其余 9。缺口：/conf/session/the-open-web 与 /conf 的 ld+json 块数为 0（无 Event）；/showcase ld+json 块数为 0。量表点名的 HowTo 全站命中 0 次，本项按「页型专用」实质判定，以 TechArticle/LearningResource 计。"
    },
    {
      "id": "p2.answer-passages",
      "state": "scored",
      "points": 9,
      "max": 9,
      "tier_reason": "第 9 档「多数页有」：6/8 通过（超过半数即第 7 档的线）。未降到第 7 档，是因为 6/8 已构成多数；但其中首页与 docs-install 属边界通过（见 notes 第 4 条），若按最严口径只认 HTML 视图的散文段则为 4/8，那会落到第 7 档。",
      "evidence": "口径：英文 25–120 词，不限第一段，正文前部任一段。通过 6 页——首页 44 词（agent 视图 markdown）\"The React framework for the web. Next.js is used to build full-stack web applications: you write React components for the UI, and Next.js provides routing, rendering, data fetching, caching, and build tooling around them. Maintained by Vercel. Latest stable release: 16.3.4.\"；docs-install 45 词 \"`--yes` skips prompts using saved preferences or defaults. The default setup enables TypeScript, Tailwind CSS, ESLint, App Router, and Turbopack, with import alias `@/*`…\"；docs-usecache 74 词 \"The `use cache` directive allows you to mark a route, React component, or a function as cacheable…\"；blog-issues 33 词 \"Millions of developers use Next.js, and the issue tracker is one of the main ways we learn where they run into problems. It receives an average of 36 new reports each week.\"；blog-turbo 26 词 \"“Chunking” is the process of deciding which code goes into which chunk. There are a lot of ways to do chunking, each with their own tradeoffs.\"；blog-sec 43 词 \"Last week we announced an upcoming security release for Next.js. Earlier today, we moved the release forward after identifying an additional critical severity vulnerability…\"。不通过 2 页——/learn 首段 24 词（\"Go from beginner to expert by learning the foundations of Next.js and building a fully functional demo website that uses all the latest features.\"，差 1 词）；/showcase 前部仅有 ≤27 词的展示卡拼接文案，无独立成立的说明段。"
    },
    {
      "id": "p2.question-intent",
      "state": "scored",
      "points": 7,
      "max": 7,
      "tier_reason": "第 7 档「多数贴近」：6/8 通过。未停在第 5 档（半数），是因为按 v1.1 规则 6 把任务句与说明句一并计入，且量表本项写的是「标题（headings）」复数，小节标题同样计入。若只认 <title>/H1 则通过 3–5 页，会落第 3 或第 5 档。",
      "evidence": "通过——/learn H1 \"Start building with Next.js\"（任务句）+ H2 \"How does the course work?\" / \"What will I learn?\"（问句）；blog-issues \"How we closed 1,500 GitHub issues in one month\"（说明句）；blog-turbo \"How Turbopack chunks your JavaScript\"（说明句，与量表举例 How Connect works 同型）；docs-install H2 序列 \"Quick start / System requirements / Supported browsers / Create with the CLI / Run the development server / Set up TypeScript / Set up linting\"（任务句，与量表举例 Accept a payment 同型）；docs-usecache H2 \"How use cache works\"（说明句）；blog-sec \"August 2026 Security Release\"（事件名，非关键词串）。不通过——首页 <title> \"Next.js by Vercel - The React Framework\" / H1 \"The React Framework for the Web\"（品牌标签+定位语）；/showcase <title> \"Showcase | Next.js by Vercel\" / H1 \"The web framework for when it matters\"（营销标语，不对应任何提问）。"
    },
    {
      "id": "p2.freshness",
      "state": "scored",
      "points": 3,
      "max": 6,
      "tier_reason": "只取第 3 档「部分页有可见日期或 datePublished」。第 6 档写的是「多数页有，且与 dateModified 一致」，而 8 个抽样页里只有 2 页存在 dateModified（两个文档页），3 篇博客只有 dateCreated、无 dateModified，3 个页面完全无日期——「与 dateModified 一致」这个合取项只在 2/8 上可验证，2/8 不构成「多数」，按规则 2「取证据实际满足的档、不取差一点就到的档」只能停在第 3 档。这一档的判法争议见 notes 第 2 条。",